{
  "id": "adib-cashback-visa",
  "name": "ADIB Cashback Visa",
  "issuer": "Abu Dhabi Islamic Bank",
  "network": "Visa",
  "annual_fee_aed": 0,
  "fee_waiver": null,
  "fx_fee_rate": 0.0299,
  "monthly_cashback_cap_aed": null,
  "cashback_rules": [
    {
      "category": "dining",
      "rate": 0.05,
      "monthly_cap_aed": null,
      "min_monthly_spend_aed": null
    },
    {
      "category": "groceries",
      "rate": 0.03,
      "monthly_cap_aed": null,
      "min_monthly_spend_aed": null
    },
    {
      "category": "fuel",
      "rate": 0.03,
      "monthly_cap_aed": null,
      "min_monthly_spend_aed": null
    },
    {
      "category": "other",
      "rate": 0.01,
      "monthly_cap_aed": null,
      "min_monthly_spend_aed": null
    }
  ],
  "source_url": "https://www.adib.ae/en/personal-banking/cards/credit-cards/cashback-visa-card",
  "last_verified": "2026-03-23",
  "notes": "No annual fee, no minimum spend. Sharia-compliant card. 5% on dining, 3% on groceries and fuel, 1% on all other spend."
}
