{
  "id": "citibank-cashback",
  "name": "Citi Cashback Mastercard",
  "issuer": "Citibank UAE",
  "network": "Mastercard",
  "annual_fee_aed": 0,
  "fee_waiver": null,
  "fx_fee_rate": 0.0299,
  "monthly_cashback_cap_aed": null,
  "cashback_rules": [
    {
      "category": "groceries",
      "rate": 0.02,
      "monthly_cap_aed": null,
      "min_monthly_spend_aed": null
    },
    {
      "category": "dining",
      "rate": 0.02,
      "monthly_cap_aed": null,
      "min_monthly_spend_aed": null
    },
    {
      "category": "other",
      "rate": 0.01,
      "monthly_cap_aed": null,
      "min_monthly_spend_aed": null
    }
  ],
  "source_url": "https://www.citibank.ae/en/personal/creditcards/cashback/",
  "last_verified": "2026-03-29",
  "notes": "No annual fee, no minimum spend. 2% cashback on groceries and dining, 1% on all other retail spend."
}
